{"$schema":"https://json-schema.org/draft/2020-12/schema","$id":"https://fs-gg.github.io/schemas/evidence/independent-oracles/v1","category":"independent-oracles","type":"object","required":["schema","id","oracle","expected","sha256"],"properties":{"schema":{"const":"fsgg.coordination.independent-oracle/1"},"id":{"type":"string","minLength":1},"oracle":{"type":"string","minLength":1},"expected":{},"sha256":{"type":"string","pattern":"^[0-9a-f]{64}$"}},"additionalProperties":false}
