{"schema":"fsgg.coordination.independent-oracle/1","id":"GS2-03.4-independent-black-box-oracles","oracle":"eng/validate-quint-qualification.fsx","expected":{"rootCount":7,"oracleCount":11,"negativeControlCount":20,"sourceSha256":"750bb30a034ec4a1f742eae3684e9e9d1e9a84e9cd2cba0716ea028bfeec536a","configurationSha256":"6eaf28bbe22c52199e30682ed34aa017247bb56ba85266cb8a76c0d757187706","baselineSha256":"30c117907274f58bbb408e90091528eb5f48ba69b6c67264fdfac4e388fc058d"},"sha256":"ae3ba8177a8987d242ec864f23c992effed2a47099d92ffcf83b9ab77a3c7239"}
